{
  "schemaVersion": "1.0.0",
  "hardCount": 16,
  "softCount": 15,
  "templateCount": 31,
  "solverRuleKinds": [
    "time_window",
    "daily_count",
    "time_budget",
    "lodging_continuity",
    "budget",
    "route_shape",
    "poi_preference",
    "crowd_avoidance"
  ],
  "templates": [
    {
      "templateId": "earliest_departure",
      "constraintId": "c_tpl_earliest_departure",
      "defaultName": "最早出发时间",
      "defaultDescription": "每日最早出发时间不早于设定时刻",
      "type": "HARD",
      "sectionKey": "hard_must_satisfy",
      "category": "TIME",
      "solverRuleKind": "time_window",
      "legacyPatchOnly": false
    },
    {
      "templateId": "latest_end",
      "constraintId": "c_tpl_latest_end",
      "defaultName": "最晚结束时间",
      "defaultDescription": "每日结束时间不晚于设定时刻",
      "type": "HARD",
      "sectionKey": "hard_must_satisfy",
      "category": "TIME",
      "solverRuleKind": "time_window",
      "legacyPatchOnly": false
    },
    {
      "templateId": "max_daily_activity",
      "constraintId": "c_tpl_max_daily_activity",
      "defaultName": "每日最大活动时长",
      "defaultDescription": "限制单日活动总时长，避免过度疲劳",
      "type": "HARD",
      "sectionKey": "hard_must_satisfy",
      "category": "TIME",
      "solverRuleKind": "time_budget",
      "legacyPatchOnly": false
    },
    {
      "templateId": "required_rest",
      "constraintId": "c_tpl_required_rest",
      "defaultName": "必须保留的休息时间",
      "defaultDescription": "行程中须保留规定的休息与缓冲时段",
      "type": "HARD",
      "sectionKey": "hard_must_satisfy",
      "category": "TIME",
      "solverRuleKind": "time_budget",
      "legacyPatchOnly": false
    },
    {
      "templateId": "fixed_appointments",
      "constraintId": "c_tpl_fixed_appointments",
      "defaultName": "固定航班 / 预约 / 入住",
      "defaultDescription": "固定航班、预约、入住时间不可被挪动",
      "type": "HARD",
      "sectionKey": "hard_must_satisfy",
      "category": "TIME",
      "solverRuleKind": "time_window",
      "legacyPatchOnly": false
    },
    {
      "templateId": "activity_budget",
      "constraintId": "c_tpl_activity_budget",
      "defaultName": "单项活动上限",
      "defaultDescription": "单项活动花费不超过设定上限",
      "type": "HARD",
      "sectionKey": "hard_must_satisfy",
      "category": "BUDGET",
      "solverRuleKind": "budget",
      "legacyPatchOnly": false
    },
    {
      "templateId": "budget_overrun_tolerance",
      "constraintId": "c_tpl_budget_overrun_tolerance",
      "defaultName": "超预算容忍额度",
      "defaultDescription": "允许超出总预算的最大幅度（百分比或金额）",
      "type": "HARD",
      "sectionKey": "hard_must_satisfy",
      "category": "BUDGET",
      "solverRuleKind": "budget",
      "legacyPatchOnly": false
    },
    {
      "templateId": "elderly_walk_limit",
      "constraintId": "c_tpl_elderly_walk_limit",
      "defaultName": "老人步行上限",
      "defaultDescription": "老人单日步行距离不超过设定上限",
      "type": "HARD",
      "sectionKey": "hard_must_satisfy",
      "category": "MEMBER",
      "solverRuleKind": "daily_count",
      "legacyPatchOnly": false
    },
    {
      "templateId": "child_nap_time",
      "constraintId": "c_tpl_child_nap_time",
      "defaultName": "儿童午睡时间",
      "defaultDescription": "午睡时段内不得安排高强度活动",
      "type": "HARD",
      "sectionKey": "hard_must_satisfy",
      "category": "MEMBER",
      "solverRuleKind": "time_window",
      "legacyPatchOnly": false
    },
    {
      "templateId": "accessibility",
      "constraintId": "c_tpl_accessibility",
      "defaultName": "无障碍要求",
      "defaultDescription": "行程须满足轮椅、坡道等无障碍通行要求",
      "type": "HARD",
      "sectionKey": "hard_must_satisfy",
      "category": "MEMBER",
      "solverRuleKind": "route_shape",
      "legacyPatchOnly": false
    },
    {
      "templateId": "motion_sickness",
      "constraintId": "c_tpl_motion_sickness",
      "defaultName": "晕车 / 恐高限制",
      "defaultDescription": "避免引发晕车、恐高等不适的安排",
      "type": "HARD",
      "sectionKey": "hard_must_satisfy",
      "category": "MEMBER",
      "solverRuleKind": "route_shape",
      "legacyPatchOnly": false
    },
    {
      "templateId": "dietary_restrictions",
      "constraintId": "c_tpl_dietary_restrictions",
      "defaultName": "饮食禁忌",
      "defaultDescription": "餐饮安排须避开设定饮食禁忌",
      "type": "HARD",
      "sectionKey": "hard_must_satisfy",
      "category": "MEMBER",
      "solverRuleKind": "poi_preference",
      "legacyPatchOnly": false
    },
    {
      "templateId": "no_unpaved_road",
      "constraintId": "c_tpl_no_unpaved_road",
      "defaultName": "不走未铺装道路",
      "defaultDescription": "不得安排未铺装或高风险路况路段",
      "type": "HARD",
      "sectionKey": "hard_must_satisfy",
      "category": "RISK",
      "solverRuleKind": "route_shape",
      "legacyPatchOnly": false
    },
    {
      "templateId": "no_bad_weather",
      "constraintId": "c_tpl_no_bad_weather",
      "defaultName": "不在恶劣天气出行",
      "defaultDescription": "恶劣天气条件下不得安排受影响出行",
      "type": "HARD",
      "sectionKey": "hard_must_satisfy",
      "category": "RISK",
      "solverRuleKind": "route_shape",
      "legacyPatchOnly": false
    },
    {
      "templateId": "no_high_risk_activity",
      "constraintId": "c_tpl_no_high_risk_activity",
      "defaultName": "不参加高风险活动",
      "defaultDescription": "不得安排高风险或未评估活动",
      "type": "HARD",
      "sectionKey": "hard_must_satisfy",
      "category": "RISK",
      "solverRuleKind": "poi_preference",
      "legacyPatchOnly": false
    },
    {
      "templateId": "no_unverified_route",
      "constraintId": "c_tpl_no_unverified_route",
      "defaultName": "不接受无官方证据路线",
      "defaultDescription": "不接受缺乏官方证据或验证的路线",
      "type": "HARD",
      "sectionKey": "hard_must_satisfy",
      "category": "RISK",
      "solverRuleKind": "route_shape",
      "legacyPatchOnly": false
    },
    {
      "templateId": "lunch_time_window",
      "constraintId": "c_tpl_lunch_time_window",
      "defaultName": "午餐时间窗",
      "defaultDescription": "午餐尽量安排在 12:00–13:30，避免过晚影响下午行程",
      "type": "SOFT",
      "sectionKey": "soft_prefer",
      "solverRuleKind": "time_window",
      "legacyPatchOnly": false,
      "canonicalWeightKey": "lunch_window_deviation",
      "defaultPriority": 5,
      "defaultIntensity": 50
    },
    {
      "templateId": "max_major_pois_per_day",
      "constraintId": "c_tpl_max_major_pois_per_day",
      "defaultName": "每日主要景点上限",
      "defaultDescription": "每天最好不超过 3 个主要景点，避免行程过满",
      "type": "SOFT",
      "sectionKey": "soft_prefer",
      "solverRuleKind": "daily_count",
      "legacyPatchOnly": false,
      "canonicalWeightKey": "poi_count_deviation",
      "defaultPriority": 5,
      "defaultIntensity": 50
    },
    {
      "templateId": "minimize_hotel_changes",
      "constraintId": "c_tpl_minimize_hotel_changes",
      "defaultName": "少换酒店",
      "defaultDescription": "尽量连续住同一家酒店，减少打包与通勤成本",
      "type": "SOFT",
      "sectionKey": "soft_prefer",
      "solverRuleKind": "lodging_continuity",
      "legacyPatchOnly": false,
      "canonicalWeightKey": "fewer_hotel_changes",
      "defaultPriority": 8,
      "defaultIntensity": 85
    },
    {
      "templateId": "daily_free_time",
      "constraintId": "c_tpl_daily_free_time",
      "defaultName": "每日自由时间",
      "defaultDescription": "每天保留约 1 小时自由时间，应对临时调整或休息",
      "type": "SOFT",
      "sectionKey": "soft_prefer",
      "solverRuleKind": "time_budget",
      "legacyPatchOnly": false,
      "canonicalWeightKey": "free_time_shortfall",
      "defaultPriority": 5,
      "defaultIntensity": 50
    },
    {
      "templateId": "avoid_early",
      "constraintId": "c_tpl_avoid_early",
      "defaultName": "尽量避免早起",
      "defaultDescription": "控制连续早出发天数，优先安排合理出发时刻",
      "type": "SOFT",
      "sectionKey": "soft_prefer",
      "solverRuleKind": "time_window",
      "legacyPatchOnly": false,
      "canonicalWeightKey": "early_departure_penalty",
      "defaultPriority": 5,
      "defaultIntensity": 50
    },
    {
      "templateId": "avoid_backtracking",
      "constraintId": "c_tpl_avoid_backtracking",
      "defaultName": "尽量不走回头路",
      "defaultDescription": "路线规划时减少折返与重复路段",
      "type": "SOFT",
      "sectionKey": "soft_prefer",
      "solverRuleKind": "route_shape",
      "legacyPatchOnly": false,
      "canonicalWeightKey": "backtracking_penalty",
      "defaultPriority": 5,
      "defaultIntensity": 50
    },
    {
      "templateId": "prefer_nature_scenery",
      "constraintId": "c_tpl_prefer_nature_scenery",
      "defaultName": "多安排自然景观",
      "defaultDescription": "排程时倾向自然风光、观景点与户外体验",
      "type": "SOFT",
      "sectionKey": "soft_prefer",
      "solverRuleKind": "poi_preference",
      "legacyPatchOnly": false,
      "canonicalWeightKey": "nature_scenery_boost",
      "defaultPriority": 5,
      "defaultIntensity": 50
    },
    {
      "templateId": "less_shopping",
      "constraintId": "c_tpl_less_shopping",
      "defaultName": "少安排购物",
      "defaultDescription": "控制购物点数量与时长，把时间留给核心体验",
      "type": "SOFT",
      "sectionKey": "soft_prefer",
      "solverRuleKind": "poi_preference",
      "legacyPatchOnly": false,
      "canonicalWeightKey": "shopping_penalty",
      "defaultPriority": 3,
      "defaultIntensity": 25
    },
    {
      "templateId": "sunset_photography",
      "constraintId": "c_tpl_sunset_photography",
      "defaultName": "日落摄影",
      "defaultDescription": "在条件允许时优先预留日落拍摄时段与机位",
      "type": "SOFT",
      "sectionKey": "soft_prefer",
      "solverRuleKind": "time_window",
      "legacyPatchOnly": false,
      "canonicalWeightKey": "photography_timing",
      "defaultPriority": 3,
      "defaultIntensity": 25
    },
    {
      "templateId": "budget_soft",
      "constraintId": "c_tpl_budget_soft",
      "defaultName": "控制预算",
      "defaultDescription": "尽量控制花费；与其他软约束冲突时可适度让步",
      "type": "SOFT",
      "sectionKey": "soft_prefer",
      "solverRuleKind": "budget",
      "legacyPatchOnly": false,
      "canonicalWeightKey": "budget_deviation",
      "defaultPriority": 8,
      "defaultIntensity": 85
    },
    {